{
  "$schema": "https://json-schema.org/draft/2020-12/schema",
  "$id": "inventory-flashsale/outbox-envelope.v1",
  "type": "object",
  "required": [
    "id",
    "aggregateType",
    "aggregateId",
    "eventType",
    "eventVersion",
    "occurredAt",
    "payload"
  ],
  "properties": {
    "id": { "type": "string" },
    "aggregateType": { "type": "string" },
    "aggregateId": { "type": "string" },
    "eventType": { "type": "string" },
    "eventVersion": { "type": "integer", "minimum": 1 },
    "occurredAt": { "type": "string", "format": "date-time" },
    "payload": { "type": "object" }
  },
  "additionalProperties": false
}
